{
	"$schema": "./platform/node_modules/@flowdular/sdk/packages/contracts/schemas/project.schema.json",
	"schemaVersion": 1,
	"architectureVersion": "0.2.0",
	"specs": {
		"platformRoot": "specs",
		"moduleDirectory": "spec"
	},
	"modules": {
		"roots": ["modules"],
		"enabled": [
			"system.core",
			"auth.core",
			"access.core",
			"reports.core",
			"metering.core",
			"agents.core",
			"approvals.core",
			"audit.core",
			"workflows.core",
			"automations.core",
			"connectors.core",
			"directory.core",
			"documents.core",
			"exports.core",
			"import.core",
			"notifications.core",
			"profile.core",
			"research.core",
			"sandbox.core",
			"search.core",
			"users.core",
			"example.core"
		]
	},
	"locales": ["en", "pl"],
	"agent": {
		"policy": ".ai/policies/capabilities.yaml",
		"modelRouting": ".ai/policies/model-routing.yaml",
		"blueprints": ".ai/blueprints"
	}
}
